question_id,question,zero_shot_answer,dlr_2step_answer,slim_ontology_answer
1,"How do variations in cryospheric indicators, such as glacier retreat and sea ice extent, influence carbon flux dynamics and land surface heat absorption patterns?","Variations in cryospheric indicators significantly impact carbon flux and heat absorption through albedo changes, permafrost thaw, and altered ocean circulation patterns. Glacier retreat exposes darker surfaces that absorb more solar radiation, while sea ice loss reduces Earth's albedo, leading to increased heat absorption and potential amplification of global warming trends.","Variations in cryospheric indicators such as glacier retreat and sea ice extent have profound impacts on carbon flux dynamics and land surface heat absorption patterns through multiple interconnected mechanisms. Glacier retreat exposes previously frozen organic matter, leading to increased decomposition and carbon release, while reduced sea ice extent decreases Earth's albedo, resulting in greater solar energy absorption and surface warming. These changes create positive feedback loops that amplify climate change effects, with significant implications for global carbon cycling and energy balance.","Glacier retreat and sea ice extent variations influence carbon flux and heat absorption through albedo feedback, permafrost degradation, and altered ocean-atmosphere interactions. As glaciers retreat, they expose darker land surfaces that absorb more solar radiation, while sea ice loss reduces the planet's reflectivity. These changes lead to increased surface warming, which can accelerate permafrost thaw and release stored carbon, further amplifying climate change through positive feedback mechanisms."
2,"What are the primary differences between cryospheric indicators and land surface temperature indicators in terms of their response to climate change?","Cryospheric indicators like glacier mass balance and sea ice extent respond more slowly but dramatically to climate change, showing clear long-term trends, while land surface temperature indicators respond more immediately to atmospheric conditions but can be influenced by local factors and short-term variability.","Cryospheric indicators such as glacier mass balance, sea ice extent, and snow cover exhibit delayed but substantial responses to climate change, often demonstrating clear, long-term trends that reflect cumulative climate impacts. In contrast, land surface temperature indicators respond more rapidly to atmospheric conditions but can be influenced by local microclimatic factors, diurnal cycles, and short-term weather variability, making them more sensitive to immediate environmental changes but potentially less indicative of long-term climate trends.","The primary differences lie in response timescales and sensitivity: cryospheric indicators integrate climate signals over longer periods and show more dramatic changes once thresholds are crossed, while land surface temperature indicators respond more immediately to atmospheric forcing but can be affected by local conditions such as vegetation cover, soil moisture, and urban heat island effects."
3,"How do changes in cryospheric extent affect global sea level rise, and what are the regional variations in these impacts?","Changes in cryospheric extent contribute to sea level rise primarily through the melting of land-based ice, with Greenland and Antarctic ice sheets being the largest contributors. Regional variations occur due to differences in ice sheet dynamics, with some regions experiencing faster melting rates than others.","Changes in cryospheric extent significantly contribute to global sea level rise through two primary mechanisms: the melting of land-based ice (glaciers, ice sheets) and the thermal expansion of seawater. The Greenland and Antarctic ice sheets are the largest contributors to sea level rise, with regional variations driven by differences in ice sheet dynamics, ocean circulation patterns, and atmospheric conditions. Coastal regions experience the most immediate impacts, with some areas facing higher-than-average sea level rise due to local factors such as land subsidence and ocean currents.","Cryospheric changes affect sea level rise through ice mass loss from glaciers and ice sheets, with regional variations influenced by factors such as ice sheet stability, ocean temperature patterns, and gravitational effects. While Greenland and Antarctica contribute most to global sea level rise, regional impacts vary significantly due to local geophysical characteristics and oceanographic conditions."
4,"What role do cryospheric indicators play in predicting extreme weather events, and how do they compare to traditional meteorological indicators?","Cryospheric indicators provide long-term climate context and can help predict seasonal weather patterns, while traditional meteorological indicators offer short-term forecasting capabilities. Together they provide a more comprehensive understanding of weather and climate interactions.","Cryospheric indicators play a crucial role in predicting extreme weather events by providing long-term climate context and identifying trends that can influence weather patterns over seasons to decades. While traditional meteorological indicators offer high-resolution, short-term forecasting capabilities, cryospheric indicators help identify larger-scale climate patterns that may increase the likelihood of extreme events such as cold air outbreaks, heatwaves, or intense precipitation events.","Cryospheric indicators complement traditional meteorological indicators by providing insights into long-term climate trends and large-scale atmospheric patterns. While meteorological indicators are essential for short-term weather forecasting, cryospheric indicators help predict seasonal to decadal climate variations and can indicate increased risks of extreme weather events associated with changing climate conditions."
5,"How do different cryospheric components (glaciers, sea ice, permafrost) interact with each other and with the broader climate system?","Different cryospheric components interact through complex feedback mechanisms, with changes in one component often amplifying or mitigating changes in others. For example, reduced sea ice can lead to increased ocean heat absorption, which may accelerate glacier melt and permafrost thaw.","Cryospheric components interact through complex feedback mechanisms that amplify or mitigate climate change impacts. Reduced sea ice extent leads to increased ocean heat absorption, which can accelerate glacier melt and permafrost thaw. Melting glaciers contribute freshwater to oceans, potentially affecting ocean circulation patterns and sea ice formation. Permafrost thaw releases greenhouse gases, further amplifying warming. These interactions create a complex web of feedbacks that influence the broader climate system.","The interactions between cryospheric components are characterized by positive and negative feedback loops. Sea ice loss increases ocean heat uptake, which can enhance glacier melting and permafrost degradation. Glacier melt contributes to sea level rise and freshwater input to oceans, potentially altering ocean circulation. Permafrost thaw releases carbon, creating additional warming. These interactions demonstrate the interconnected nature of the cryosphere and its role in climate system dynamics."
6,"What are the main challenges in using cryospheric indicators for climate modeling, and how can these be addressed?","Main challenges include data gaps in remote regions, complex feedback processes that are difficult to model, and the need for higher resolution observations. These can be addressed through improved satellite monitoring, enhanced modeling of feedback mechanisms, and integration of multiple data sources.","The main challenges in using cryospheric indicators for climate modeling include data gaps in remote and inaccessible regions, complex nonlinear feedback processes that are difficult to parameterize, and the need for higher spatial and temporal resolution observations. These challenges can be addressed through advancements in satellite remote sensing technology, improved physical process modeling, integration of multiple data sources, and enhanced computational capabilities for high-resolution climate simulations.","Challenges in cryospheric climate modeling include incomplete spatial coverage, uncertainties in representing complex physical processes, and limitations in capturing small-scale variability. Addressing these requires investments in remote sensing infrastructure, development of more sophisticated process-based models, assimilation of diverse observational datasets, and increased computational resources for high-resolution simulations."
7,"How do cryospheric changes impact biodiversity and ecosystem services in polar and high-altitude regions?","Cryospheric changes significantly impact biodiversity by altering habitats, food availability, and species distributions. These changes also affect ecosystem services such as water regulation, carbon sequestration, and cultural services for indigenous communities.","Cryospheric changes have profound impacts on biodiversity and ecosystem services in polar and high-altitude regions. Melting ice and changing snow patterns alter habitats and food availability, leading to shifts in species distributions and potential biodiversity loss. These changes also affect critical ecosystem services such as water regulation, carbon sequestration, and cultural services for indigenous communities that depend on cryospheric ecosystems for their livelihoods and traditions.","The impacts of cryospheric changes on biodiversity include habitat loss, altered species interactions, and range shifts for cold-adapted species. Ecosystem services affected include water supply regulation, carbon storage in permafrost and glacial systems, and cultural services for indigenous populations. These changes can have cascading effects throughout food webs and may lead to significant ecological and socio-economic consequences."
8,"What are the socioeconomic implications of cryospheric changes for communities dependent on glacial meltwater?","Communities dependent on glacial meltwater face water scarcity challenges as glaciers retreat, affecting agriculture, hydropower generation, and domestic water supplies. This can lead to economic instability and potential conflicts over water resources.","Cryospheric changes have significant socioeconomic implications for communities dependent on glacial meltwater. As glaciers retreat, these communities face increasing water scarcity, which affects agricultural productivity, hydropower generation, and domestic water supplies. The resulting economic instability can lead to migration pressures, changes in traditional livelihoods, and potential conflicts over water resources, particularly in regions where multiple communities or countries share glacial water sources.","The socioeconomic impacts of glacial retreat include reduced water availability for irrigation, drinking water, and hydropower production. This can lead to decreased agricultural output, economic instability, and increased competition for water resources. Communities may need to adapt through water management strategies, diversification of livelihoods, and potential relocation in extreme cases."
9,"How do cryospheric indicators contribute to our understanding of paleoclimate conditions and historical climate variability?","Cryospheric indicators such as ice cores provide valuable records of past climate conditions, including temperature, atmospheric composition, and volcanic activity. These records help reconstruct historical climate variability and improve our understanding of natural climate cycles.","Cryospheric indicators, particularly ice cores from glaciers and ice sheets, provide invaluable records of paleoclimate conditions and historical climate variability. These indicators preserve information about past temperatures, atmospheric composition, volcanic activity, and other environmental conditions, allowing scientists to reconstruct climate history over thousands to hundreds of thousands of years. This historical perspective is crucial for understanding natural climate variability and placing current climate change in a long-term context.","Ice cores and other cryospheric archives serve as natural climate records, preserving information about past atmospheric conditions, temperature variations, and environmental changes. By analyzing these indicators, scientists can reconstruct paleoclimate conditions, identify natural climate cycles, and better understand the drivers of historical climate variability, which helps improve climate models and projections of future change."
10,"What are the potential feedback mechanisms between cryospheric changes and atmospheric circulation patterns?","Potential feedback mechanisms include altered albedo affecting atmospheric heating patterns, changes in ocean circulation influencing atmospheric moisture transport, and modified surface energy balances affecting atmospheric pressure systems and wind patterns.","Potential feedback mechanisms between cryospheric changes and atmospheric circulation patterns include altered surface albedo affecting atmospheric heating and cooling patterns, changes in ocean circulation influencing atmospheric moisture transport and storm tracks, and modified surface energy balances affecting atmospheric pressure systems and wind patterns. These feedbacks can lead to shifts in jet stream behavior, changes in precipitation patterns, and alterations in regional climate regimes.","The feedback mechanisms involve complex interactions where cryospheric changes modify surface energy budgets, which in turn affect atmospheric heating patterns and circulation. Reduced sea ice and snow cover alter albedo, leading to increased surface warming that can influence atmospheric pressure gradients and wind patterns. Changes in ocean circulation driven by freshwater input from melting ice can also affect atmospheric moisture transport and storm development."